{
  "ok": true,
  "api_key_fingerprint": "ab9564121801b791",
  "allow": true,
  "deny_reasons": [],
  "latency_ms": 3,
  "policy": {
    "policy_set_id": "policy:lcm.market.v1",
    "policy_set_version": "2026-01-01"
  },
  "proof": {
    "trust_level": "supported",
    "policy_ref_id": "policy:lcm.market.v1",
    "checks": [
      { "check_id": "policy.link.enforced", "status": "pass", "message": "Decision linked to explicit policy set" },
      { "check_id": "policy.rule.match", "status": "pass", "message": "Policy rule matched" }
    ],
    "references": [
      { "type": "policy", "ref_id": "policy:lcm.market.v1", "uri": null }
    ],
    "limitations": []
  }
}
